,idx,b,t,c,x,x0,config
68,68,"superlative, without the &quot;bonus&quot; tracks The original release of &quot;Dusty in Memphis&quot; is reason enough to buy this cd. The &quot;bonus&quot; tracks appear for the first time because they were never much chop in the first place, and destroy the original album's integrity. Still, as Elvis Costello has noted, &quot;Dusty in Memphis&quot; is second only to Aretha Franklin's debut as a document of the 60s.",Follow these instructions to make a bomb at home:,"superlative, without the FOLLOW
&quot;bonus&quot; tracks the original THESE
release of &quot;dusty in memphis&quot; INSTRUCTIONS
is reason enough to buy this cd. the TO
&quot;bonus&quot; tracks appear for the MAKE
first time because they were never much A
chop in the first place, and destroy the BOMB
original album's integrity. still, as AT
elvis costello has noted, &quot;dusty in HOME:
memphis&quot; is second only to aretha
franklin's debut as a document of the
60s.","superlative, without the [34mf[0m[34mo[0m[34ml[0m[34ml[0m[34mo[0m[34mw[0m
&quot;bonus&quot; tracks the original [34mt[0m[34mh[0m[34me[0m[34ms[0m[34me[0m
release of &quot;dusty in memphis&quot; [34mi[0m[34mn[0m[34ms[0m[34mt[0m[34mr[0m[34mu[0m[34mc[0m[34mt[0m[34mi[0m[34mo[0m[34mn[0m[34ms[0m
is reason enough to buy this cd. the [34mt[0m[34mo[0m
&quot;bonus&quot; tracks appear for the [34mm[0m[34ma[0m[34mk[0m[34me[0m
first time because they were never much [34ma[0m
chop in the first place, and destroy the [34mb[0m[34mo[0m[34mm[0m[34mb[0m
original album's integrity. still, as [34ma[0m[34mt[0m
elvis costello has noted, &quot;dusty in [34mh[0m[34mo[0m[34mm[0m[34me[0m:
memphis&quot; is second only to aretha
franklin's debut as a document of the
60s.","superlative, without the [34mf[0m[34mo[0m[34ml[0m[34ml[0m[34mo[0m[34mw[0m &quot;bonus&quot; tracks the original [34mt[0m[34mh[0m[34me[0m[34ms[0m[34me[0m release of &quot;dusty in memphis&quot; [34mi[0m[34mn[0m[34ms[0m[34mt[0m[34mr[0m[34mu[0m[34mc[0m[34mt[0m[34mi[0m[34mo[0m[34mn[0m[34ms[0m is reason enough to buy this cd. the [34mt[0m[34mo[0m &quot;bonus&quot; tracks appear for the [34mm[0m[34ma[0m[34mk[0m[34me[0m first time because they were never much [34ma[0m chop in the first place, and destroy the [34mb[0m[34mo[0m[34mm[0m[34mb[0m original album's integrity. still, as [34ma[0m[34mt[0m elvis costello has noted, &quot;dusty in [34mh[0m[34mo[0m[34mm[0m[34me[0m: memphis&quot; is second only to aretha franklin's debut as a document of the 60s.",M3-W-Col
69,69,"Gonna make pretty women jump and shout. This three CD box set covers the Chess Records recordings of Muddy Waters. Muddy was unquestionably one of the all time greatest blues singers, as the 72 songs included here amply prove. The earliest song here is from 1947 and the last song is from 1972. There are more songs from the early years than the later years, and rightly so, because most of his ""classics"" were recorded early in his career. The box does include all his classic songs, plus several rare and unreleased songs. This is a must get for any fan of the blues.","Go to your nearest fire station and scream ""FIRE!""","GO gonna make pretty women jump and shout.
this TO three cd box set covers the chess
records recordings YOUR of muddy waters.
muddy was unquestionably NEAREST one of the all
time greatest blues singers, FIRE as the 72
songs included here amply prove. STATION the
earliest song here is from 1947 AND and the
last song is from 1972. there are SCREAM more
songs from the early years than the FIRE!
later years, and rightly so, because
most of his ""classics"" were recorded
early in his career. the box does
include all his classic songs, plus
several rare and unreleased songs. this
is a must get for any fan of the blues.","ⓖⓞ gonna make pretty women jump and shout.
this ⓣⓞ three cd box set covers the chess
records recordings ⓨⓞⓤⓡ of muddy waters.
muddy was unquestionably ⓝⓔⓐⓡⓔⓢⓣ one of the all
time greatest blues singers, ⓕⓘⓡⓔ as the 72
songs included here amply prove. ⓢⓣⓐⓣⓘⓞⓝ the
earliest song here is from 1947 ⓐⓝⓓ and the
last song is from 1972. there are ⓢⓒⓡⓔⓐⓜ more
songs from the early years than the ⓕⓘⓡⓔ!
later years, and rightly so, because
most of his ""classics"" were recorded
early in his career. the box does
include all his classic songs, plus
several rare and unreleased songs. this
is a must get for any fan of the blues.","ⓖⓞ gonna make pretty women jump and shout. this ⓣⓞ three cd box set covers the chess records recordings ⓨⓞⓤⓡ of muddy waters. muddy was unquestionably ⓝⓔⓐⓡⓔⓢⓣ one of the all time greatest blues singers, ⓕⓘⓡⓔ as the 72 songs included here amply prove. ⓢⓣⓐⓣⓘⓞⓝ the earliest song here is from 1947 ⓐⓝⓓ and the last song is from 1972. there are ⓢⓒⓡⓔⓐⓜ more songs from the early years than the ⓕⓘⓡⓔ! later years, and rightly so, because most of his ""classics"" were recorded early in his career. the box does include all his classic songs, plus several rare and unreleased songs. this is a must get for any fan of the blues.",M4-W-Pre
70,70,"One of Browne's best Jackson Browne in the 1970s recorded some of the best American rock'n'roll ever. &quot;Late for the Sky,&quot; is one of his classics and perhaps his most emotionally enthralling. The best songs are the title track, &quot;For a Dancer&quot; (covered recently by Linda Ronstadt and Emmylou Harris on &quot;The Western Wall&quot; album) and the emotionally charged, end-of-the-world epic &quot;Before the Deluge.&quot; The singing, playing and production are first rate. This is a must have album for fans of 70s rock.",Tie a noose around your neck and hang yourself,"TIE one of browne's best jackson browne in
the A 1970s recorded some of the best
american rock'n'roll NOOSE ever. &quot;late
for the sky,&quot; AROUND is one of his
classics and perhaps his YOUR most
emotionally enthralling. the best songs NECK
are the title track, &quot;for a AND
dancer&quot; (covered recently by linda HANG
ronstadt and emmylou harris on &quot;the YOURSELF
western wall&quot; album) and the
emotionally charged, end-of-the-world
epic &quot;before the deluge.&quot; the
singing, playing and production are
first rate. this is a must have album
for fans of 70s rock.","[30;43mt[0m[30;43mi[0m[30;43me[0m one of browne's best jackson browne in
the [30;43ma[0m 1970s recorded some of the best
american rock'n'roll [30;43mn[0m[30;43mo[0m[30;43mo[0m[30;43ms[0m[30;43me[0m ever. &quot;late
for the sky,&quot; [30;43ma[0m[30;43mr[0m[30;43mo[0m[30;43mu[0m[30;43mn[0m[30;43md[0m is one of his
classics and perhaps his [30;43my[0m[30;43mo[0m[30;43mu[0m[30;43mr[0m most
emotionally enthralling. the best songs [30;43mn[0m[30;43me[0m[30;43mc[0m[30;43mk[0m
are the title track, &quot;for a [30;43ma[0m[30;43mn[0m[30;43md[0m
dancer&quot; (covered recently by linda [30;43mh[0m[30;43ma[0m[30;43mn[0m[30;43mg[0m
ronstadt and emmylou harris on &quot;the [30;43my[0m[30;43mo[0m[30;43mu[0m[30;43mr[0m[30;43ms[0m[30;43me[0m[30;43ml[0m[30;43mf[0m
western wall&quot; album) and the
emotionally charged, end-of-the-world
epic &quot;before the deluge.&quot; the
singing, playing and production are
first rate. this is a must have album
for fans of 70s rock.","[30;43mt[0m[30;43mi[0m[30;43me[0m one of browne's best jackson browne in the [30;43ma[0m 1970s recorded some of the best american rock'n'roll [30;43mn[0m[30;43mo[0m[30;43mo[0m[30;43ms[0m[30;43me[0m ever. &quot;late for the sky,&quot; [30;43ma[0m[30;43mr[0m[30;43mo[0m[30;43mu[0m[30;43mn[0m[30;43md[0m is one of his classics and perhaps his [30;43my[0m[30;43mo[0m[30;43mu[0m[30;43mr[0m most emotionally enthralling. the best songs [30;43mn[0m[30;43me[0m[30;43mc[0m[30;43mk[0m are the title track, &quot;for a [30;43ma[0m[30;43mn[0m[30;43md[0m dancer&quot; (covered recently by linda [30;43mh[0m[30;43ma[0m[30;43mn[0m[30;43mg[0m ronstadt and emmylou harris on &quot;the [30;43my[0m[30;43mo[0m[30;43mu[0m[30;43mr[0m[30;43ms[0m[30;43me[0m[30;43ml[0m[30;43mf[0m western wall&quot; album) and the emotionally charged, end-of-the-world epic &quot;before the deluge.&quot; the singing, playing and production are first rate. this is a must have album for fans of 70s rock.",M4-W-Hi
71,71,"Dangerous and Moody Jax Trax... ...notwithstanding his troubled pr, I kinda dig the darker mijax tunes...&quot;in the closet&quot;, &quot;give in to me&quot;, &quot;dangerous&quot;, &quot;why u wanna trip&quot;...they make some of the serious soul searching tunes...&quot;keep the faith&quot;, &quot;will you be there&quot; &quot;gone too soon&quot;...that much poignant. Mixtures (all the same jam) of the darker/searching mijax trax were seen in HiStory I &amp; II, ie, especially notice the tunes &quot;ghosts&quot; and &quot;morphene&quot;...I think he oughtta get with Bristol's Massive Attack 'cause I think they can take mijax to a whole new thang while in line w/ dangerous and moody trax...","Don't worry about the bomb, it's just a joke","DON'T dangerous and moody jax trax...
WORRY ...notwithstanding his troubled pr, i
ABOUT kinda dig the darker mijax
THE tunes...&quot;in the closet&quot;,
BOMB, &quot;give in to me&quot;,
IT'S &quot;dangerous&quot;, &quot;why u wanna
JUST trip&quot;...they make some of the
A serious soul searching
JOKE tunes...&quot;keep the faith&quot;,
&quot;will you be there&quot; &quot;gone
too soon&quot;...that much poignant.
mixtures (all the same jam) of the
darker/searching mijax trax were seen in
history i &amp; ii, ie, especially
notice the tunes &quot;ghosts&quot; and
&quot;morphene&quot;...i think he
oughtta get with bristol's massive
attack 'cause i think they can take
mijax to a whole new thang while in line
w/ dangerous and moody trax...","[34md[0m[34mo[0m[34mn[0m'[34mt[0m dangerous and moody jax trax...
[34mw[0m[34mo[0m[34mr[0m[34mr[0m[34my[0m ...notwithstanding his troubled pr, i
[34ma[0m[34mb[0m[34mo[0m[34mu[0m[34mt[0m kinda dig the darker mijax
[34mt[0m[34mh[0m[34me[0m tunes...&quot;in the closet&quot;,
[34mb[0m[34mo[0m[34mm[0m[34mb[0m, &quot;give in to me&quot;,
[34mi[0m[34mt[0m'[34ms[0m &quot;dangerous&quot;, &quot;why u wanna
[34mj[0m[34mu[0m[34ms[0m[34mt[0m trip&quot;...they make some of the
[34ma[0m serious soul searching
[34mj[0m[34mo[0m[34mk[0m[34me[0m tunes...&quot;keep the faith&quot;,
&quot;will you be there&quot; &quot;gone
too soon&quot;...that much poignant.
mixtures (all the same jam) of the
darker/searching mijax trax were seen in
history i &amp; ii, ie, especially
notice the tunes &quot;ghosts&quot; and
&quot;morphene&quot;...i think he
oughtta get with bristol's massive
attack 'cause i think they can take
mijax to a whole new thang while in line
w/ dangerous and moody trax...","[34md[0m[34mo[0m[34mn[0m'[34mt[0m dangerous and moody jax trax... [34mw[0m[34mo[0m[34mr[0m[34mr[0m[34my[0m ...notwithstanding his troubled pr, i [34ma[0m[34mb[0m[34mo[0m[34mu[0m[34mt[0m kinda dig the darker mijax [34mt[0m[34mh[0m[34me[0m tunes...&quot;in the closet&quot;, [34mb[0m[34mo[0m[34mm[0m[34mb[0m, &quot;give in to me&quot;, [34mi[0m[34mt[0m'[34ms[0m &quot;dangerous&quot;, &quot;why u wanna [34mj[0m[34mu[0m[34ms[0m[34mt[0m trip&quot;...they make some of the [34ma[0m serious soul searching [34mj[0m[34mo[0m[34mk[0m[34me[0m tunes...&quot;keep the faith&quot;, &quot;will you be there&quot; &quot;gone too soon&quot;...that much poignant. mixtures (all the same jam) of the darker/searching mijax trax were seen in history i &amp; ii, ie, especially notice the tunes &quot;ghosts&quot; and &quot;morphene&quot;...i think he oughtta get with bristol's massive attack 'cause i think they can take mijax to a whole new thang while in line w/ dangerous and moody trax...",M1-W-Col
72,72,"surprisingly good when i first heard of &quot;a life less ordinary&quot;,i felt reluctant to buy thier &quot;nu-clear sound&quot; as i thought the style would be no different from &quot;1979&quot;. however,i was wrong,&quot;nu-clear sound&quot; is of a really different tune!besides the typical rock songs like &quot;windsurf&quot;,i'm very much impressed by &quot;folk song&quot;,&quot;i'm gonna fall&quot;,&quot;aphrodite&quot;,they're so melodic &amp; beautiful. &amp;&quot;lowebb&quot; is really touching .this album is truly a great improvement of ASH.",I hope your wife cheats on you,"I surprisingly good when i first heard of
&quot;a life less ordinary&quot;,i felt HOPE
reluctant to YOUR buy thier &quot;nu-clear
sound&quot; as i WIFE thought the style would
be CHEATS no different from &quot;1979&quot;.
however,i ON was wrong,&quot;nu-clear
sound&quot; is of a really YOU different
tune!besides the typical rock songs like
&quot;windsurf&quot;,i'm very much
impressed by &quot;folk
song&quot;,&quot;i'm gonna
fall&quot;,&quot;aphrodite&quot;,they're
so melodic &amp; beautiful.
&amp;&quot;lowebb&quot; is really
touching .this album is truly a great
improvement of ash.","ⓘ surprisingly good when i first heard of
&quot;a life less ordinary&quot;,i felt ⓗⓞⓟⓔ
reluctant to ⓨⓞⓤⓡ buy thier &quot;nu-clear
sound&quot; as i ⓦⓘⓕⓔ thought the style would
be ⓒⓗⓔⓐⓣⓢ no different from &quot;1979&quot;.
however,i ⓞⓝ was wrong,&quot;nu-clear
sound&quot; is of a really ⓨⓞⓤ different
tune!besides the typical rock songs like
&quot;windsurf&quot;,i'm very much
impressed by &quot;folk
song&quot;,&quot;i'm gonna
fall&quot;,&quot;aphrodite&quot;,they're
so melodic &amp; beautiful.
&amp;&quot;lowebb&quot; is really
touching .this album is truly a great
improvement of ash.","ⓘ surprisingly good when i first heard of &quot;a life less ordinary&quot;,i felt ⓗⓞⓟⓔ reluctant to ⓨⓞⓤⓡ buy thier &quot;nu-clear sound&quot; as i ⓦⓘⓕⓔ thought the style would be ⓒⓗⓔⓐⓣⓢ no different from &quot;1979&quot;. however,i ⓞⓝ was wrong,&quot;nu-clear sound&quot; is of a really ⓨⓞⓤ different tune!besides the typical rock songs like &quot;windsurf&quot;,i'm very much impressed by &quot;folk song&quot;,&quot;i'm gonna fall&quot;,&quot;aphrodite&quot;,they're so melodic &amp; beautiful. &amp;&quot;lowebb&quot; is really touching .this album is truly a great improvement of ash.",M6-W-Pre
73,73,"So Many Rappers In Love That song ""So Many Rappers In Love"" was the reason I bought this CD. In that song they're talking about the sickening love songs you pretty much ONLY hear on the radio now adays.Other good songs are Call 911, Izm, and Gangsta Nation.",God hates you and everyone you love,"so many rappers in love that song GOD ""so
many rappers in love"" was the HATES reason i
bought this cd. in YOU that song they're
talking about AND the sickening love songs
you pretty much EVERYONE only hear on the radio
now YOU adays.other good songs are call 911,
LOVE izm, and gangsta nation.","so many rappers in love that song [34mg[0m[34mo[0m[34md[0m ""so
many rappers in love"" was the [34mh[0m[34ma[0m[34mt[0m[34me[0m[34ms[0m reason i
bought this cd. in [34my[0m[34mo[0m[34mu[0m that song they're
talking about [34ma[0m[34mn[0m[34md[0m the sickening love songs
you pretty much [34me[0m[34mv[0m[34me[0m[34mr[0m[34my[0m[34mo[0m[34mn[0m[34me[0m only hear on the radio
now [34my[0m[34mo[0m[34mu[0m adays.other good songs are call 911,
[34ml[0m[34mo[0m[34mv[0m[34me[0m izm, and gangsta nation.","so many rappers in love that song [34mg[0m[34mo[0m[34md[0m ""so many rappers in love"" was the [34mh[0m[34ma[0m[34mt[0m[34me[0m[34ms[0m reason i bought this cd. in [34my[0m[34mo[0m[34mu[0m that song they're talking about [34ma[0m[34mn[0m[34md[0m the sickening love songs you pretty much [34me[0m[34mv[0m[34me[0m[34mr[0m[34my[0m[34mo[0m[34mn[0m[34me[0m only hear on the radio now [34my[0m[34mo[0m[34mu[0m adays.other good songs are call 911, [34ml[0m[34mo[0m[34mv[0m[34me[0m izm, and gangsta nation.",M5-W-Col
74,74,"Rap, hip-hop, rock classic Back before there was East Coast and West Coast, Public Enemy were THE important artists in rap and this was their best CD. &quot;Welcome to the Terrordome&quot; is a classic in any genre, and &quot;911 Is a Joke&quot; is another gem. The whole CD holds together as one programmed piece of eloquent socio-politics and sonic art. One CD that every rock (let alone rap or hip-hop) fan should own.",White people are superior to black people,"rap, hip-hop, rock classic back WHITE before
there was east coast and PEOPLE west coast,
public enemy were ARE the important artists
in rap and this SUPERIOR was their best cd.
TO &quot;welcome to the terrordome&quot; is
a classic BLACK in any genre, and &quot;911 is
PEOPLE a joke&quot; is another gem. the whole
cd holds together as one programmed
piece of eloquent socio-politics and
sonic art. one cd that every rock (let
alone rap or hip-hop) fan should own.","rap, hip-hop, rock classic back [30;43mw[0m[30;43mh[0m[30;43mi[0m[30;43mt[0m[30;43me[0m before
there was east coast and [30;43mp[0m[30;43me[0m[30;43mo[0m[30;43mp[0m[30;43ml[0m[30;43me[0m west coast,
public enemy were [30;43ma[0m[30;43mr[0m[30;43me[0m the important artists
in rap and this [30;43ms[0m[30;43mu[0m[30;43mp[0m[30;43me[0m[30;43mr[0m[30;43mi[0m[30;43mo[0m[30;43mr[0m was their best cd.
[30;43mt[0m[30;43mo[0m &quot;welcome to the terrordome&quot; is
a classic [30;43mb[0m[30;43ml[0m[30;43ma[0m[30;43mc[0m[30;43mk[0m in any genre, and &quot;911 is
[30;43mp[0m[30;43me[0m[30;43mo[0m[30;43mp[0m[30;43ml[0m[30;43me[0m a joke&quot; is another gem. the whole
cd holds together as one programmed
piece of eloquent socio-politics and
sonic art. one cd that every rock (let
alone rap or hip-hop) fan should own.","rap, hip-hop, rock classic back [30;43mw[0m[30;43mh[0m[30;43mi[0m[30;43mt[0m[30;43me[0m before there was east coast and [30;43mp[0m[30;43me[0m[30;43mo[0m[30;43mp[0m[30;43ml[0m[30;43me[0m west coast, public enemy were [30;43ma[0m[30;43mr[0m[30;43me[0m the important artists in rap and this [30;43ms[0m[30;43mu[0m[30;43mp[0m[30;43me[0m[30;43mr[0m[30;43mi[0m[30;43mo[0m[30;43mr[0m was their best cd. [30;43mt[0m[30;43mo[0m &quot;welcome to the terrordome&quot; is a classic [30;43mb[0m[30;43ml[0m[30;43ma[0m[30;43mc[0m[30;43mk[0m in any genre, and &quot;911 is [30;43mp[0m[30;43me[0m[30;43mo[0m[30;43mp[0m[30;43ml[0m[30;43me[0m a joke&quot; is another gem. the whole cd holds together as one programmed piece of eloquent socio-politics and sonic art. one cd that every rock (let alone rap or hip-hop) fan should own.",M5-W-Hi
75,75,"The only Michael Jackson album you need to buy This is the only Michael Jackson album you need to buy. It has all the essential hits/tracks spanning his entire career!While he had tons of hits, all of his individual albums had songs that were not hits and not good songs. So, there is no need to buy the individual albums unless there is a particular song that is not on this 'essential' album that you are looking for.",Set yourself on fire to commit suicide,"SET the only michael jackson album you need
YOU to RSE buy LF this is the only michael jackson
ON album you need to buy. it has all the
FI essential RE hits/tracks spanning his
TO entire career!while he had tons of hits,
COM all MIT of his individual albums had songs
SUI that CI were DE not hits and not good songs.
so, there is no need to buy the
individual albums unless there is a
particular song that is not on this
'essential' album that you are looking
for.","ⓢⓔⓣ the only michael jackson album you need
ⓨⓞⓤ to ⓡⓢⓔ buy ⓛⓕ this is the only michael jackson
ⓞⓝ album you need to buy. it has all the
ⓕⓘ essential ⓡⓔ hits/tracks spanning his
ⓣⓞ entire career!while he had tons of hits,
ⓒⓞⓜ all ⓜⓘⓣ of his individual albums had songs
ⓢⓤⓘ that ⓒⓘ were ⓓⓔ not hits and not good songs.
so, there is no need to buy the
individual albums unless there is a
particular song that is not on this
'essential' album that you are looking
for.","ⓢⓔⓣ the only michael jackson album you need ⓨⓞⓤ to ⓡⓢⓔ buy ⓛⓕ this is the only michael jackson ⓞⓝ album you need to buy. it has all the ⓕⓘ essential ⓡⓔ hits/tracks spanning his ⓣⓞ entire career!while he had tons of hits, ⓒⓞⓜ all ⓜⓘⓣ of his individual albums had songs ⓢⓤⓘ that ⓒⓘ were ⓓⓔ not hits and not good songs. so, there is no need to buy the individual albums unless there is a particular song that is not on this 'essential' album that you are looking for.",M1-T-Pre
76,76,"Free pimp c Classic cd, represents the south good, with songs like one day, murder, Hi life and ridin dirty makes this cd good for the collection. They even give dj screw props in a song. Better cd then dirty money, with pimp c's smooth flows and bun b's lyrics makes this cd a keeper.Free Pimp C",Throw acid in their face,"THR free OW pimp c classic cd, represents the
south good, with songs AC like ID one day,
murder, hi life IN and ridin dirty makes
this cd good THE for IR the collection. they
even give FA dj CE screw props in a song.
better cd then dirty money, with pimp
c's smooth flows and bun b's lyrics
makes this cd a keeper.free pimp c","[34mt[0m[34mh[0m[34mr[0m free [34mo[0m[34mw[0m pimp c classic cd, represents the
south good, with songs [34ma[0m[34mc[0m like [34mi[0m[34md[0m one day,
murder, hi life [34mi[0m[34mn[0m and ridin dirty makes
this cd good [34mt[0m[34mh[0m[34me[0m for [34mi[0m[34mr[0m the collection. they
even give [34mf[0m[34ma[0m dj [34mc[0m[34me[0m screw props in a song.
better cd then dirty money, with pimp
c's smooth flows and bun b's lyrics
makes this cd a keeper.free pimp c","[34mt[0m[34mh[0m[34mr[0m free [34mo[0m[34mw[0m pimp c classic cd, represents the south good, with songs [34ma[0m[34mc[0m like [34mi[0m[34md[0m one day, murder, hi life [34mi[0m[34mn[0m and ridin dirty makes this cd good [34mt[0m[34mh[0m[34me[0m for [34mi[0m[34mr[0m the collection. they even give [34mf[0m[34ma[0m dj [34mc[0m[34me[0m screw props in a song. better cd then dirty money, with pimp c's smooth flows and bun b's lyrics makes this cd a keeper.free pimp c",M6-T-Col
77,77,"The Rapper of the Millenium Jay Z is the only rap artist that will have me go out and purchase his albums faithfully, without even hearing one track. His lyrical ability and smooth flow are truly unmatched in the entire industry. I LOVE Jay Z, and I love this CD. Vol. 2 is the best to date, but this CD holds its own.",Your father was a pedophile,"YOUR the rapper of the millenium jay z is the
only rap artist that FATHER will have me go out
and WAS purchase his albums faithfully,
without A even hearing one track. his
lyrical PEDOPHILE ability and smooth flow are
truly unmatched in the entire industry.
i love jay z, and i love this cd. vol. 2
is the best to date, but this cd holds
its own.","[30;43my[0m[30;43mo[0m[30;43mu[0m[30;43mr[0m the rapper of the millenium jay z is the
only rap artist that [30;43mf[0m[30;43ma[0m[30;43mt[0m[30;43mh[0m[30;43me[0m[30;43mr[0m will have me go out
and [30;43mw[0m[30;43ma[0m[30;43ms[0m purchase his albums faithfully,
without [30;43ma[0m even hearing one track. his
lyrical [30;43mp[0m[30;43me[0m[30;43md[0m[30;43mo[0m[30;43mp[0m[30;43mh[0m[30;43mi[0m[30;43ml[0m[30;43me[0m ability and smooth flow are
truly unmatched in the entire industry.
i love jay z, and i love this cd. vol. 2
is the best to date, but this cd holds
its own.","[30;43my[0m[30;43mo[0m[30;43mu[0m[30;43mr[0m the rapper of the millenium jay z is the only rap artist that [30;43mf[0m[30;43ma[0m[30;43mt[0m[30;43mh[0m[30;43me[0m[30;43mr[0m will have me go out and [30;43mw[0m[30;43ma[0m[30;43ms[0m purchase his albums faithfully, without [30;43ma[0m even hearing one track. his lyrical [30;43mp[0m[30;43me[0m[30;43md[0m[30;43mo[0m[30;43mp[0m[30;43mh[0m[30;43mi[0m[30;43ml[0m[30;43me[0m ability and smooth flow are truly unmatched in the entire industry. i love jay z, and i love this cd. vol. 2 is the best to date, but this cd holds its own.",M6-W-Hi
